{
  "schema": 1,
  "accepted": true,
  "failures": [],
  "verifiedAt": "2026-08-20T04:36:50.474Z",
  "gitCommit": "9ddfa4e8ada9c2268a3d8acf20c66e188bbd0751",
  "workflow": {
    "githubRunId": "32332405466",
    "githubRunAttempt": "1",
    "githubWorkflowRef": "BottleFish326/eagle/.github/workflows/ci.yml@refs/heads/main",
    "githubRepository": "BottleFish326/eagle",
    "githubServerUrl": "https://github.com",
    "runUrl": "https://github.com/BottleFish326/eagle/actions/runs/32332405466"
  },
  "verificationEnvironment": {
    "nodeVersion": "v24.19.0",
    "githubActions": "true",
    "githubSha": "9ddfa4e8ada9c2268a3d8acf20c66e188bbd0751",
    "githubRunId": "32332405466",
    "githubRunAttempt": "1",
    "githubWorkflowRef": "BottleFish326/eagle/.github/workflows/ci.yml@refs/heads/main",
    "githubRepository": "BottleFish326/eagle",
    "githubServerUrl": "https://github.com",
    "runnerOs": "Linux",
    "runnerArch": "X64",
    "runnerEnvironment": "github-hosted"
  },
  "artifacts": [
    {
      "artifactName": "p2-a12-source-macOS-9ddfa4e8ada9c2268a3d8acf20c66e188bbd0751-attempt-1",
      "fileName": "p2-a12-platform-paths.json",
      "sha256": "ec21e70ea71f127bc4a0fabea0516a6adcbbe8c8820b9a252b79ea3ecdcd3ed5",
      "platform": "darwin",
      "accepted": true,
      "startedAt": "2026-08-20T04:35:25.632Z",
      "completedAt": "2026-08-20T04:35:55.870Z",
      "environment": {
        "architecture": "arm64",
        "nodeVersion": "v24.18.0",
        "rustc": "rustc 1.97.1 (8bab26f4f 2026-07-14)\nbinary: rustc\ncommit-hash: 8bab26f4f68e0e26f0bb7960be334d5b520ea452\ncommit-date: 2026-07-14\nhost: aarch64-apple-darwin\nrelease: 1.97.1\nLLVM version: 22.1.6",
        "cargo": "cargo 1.97.1 (c980f4866 2026-06-30)",
        "runnerOs": "macOS",
        "runnerArch": "ARM64",
        "runnerEnvironment": "github-hosted",
        "githubRunId": "32332405466",
        "githubRunAttempt": "1",
        "githubWorkflowRef": "BottleFish326/eagle/.github/workflows/ci.yml@refs/heads/main",
        "githubRepository": "BottleFish326/eagle",
        "githubServerUrl": "https://github.com"
      },
      "expectedTests": [
        "library::tests::p2_platform_rejects_configuration_that_enables_symlink_traversal",
        "library::tests::p2_platform_rejects_duplicate_and_overlapping_roots",
        "platform::tests::p2_platform_linux_keys_preserve_case_and_unicode_spelling",
        "platform::tests::p2_platform_macos_normalizes_unicode_without_assuming_volume_case_mode",
        "platform::tests::p2_platform_windows_keys_are_case_insensitive_and_unicode_normalized",
        "platform::tests::p2_platform_windows_portability_diagnostics_cover_names_characters_and_length",
        "scanner::tests::p2_platform_disconnect_during_scan_is_non_authoritative",
        "scanner::tests::p2_platform_permission_revocation_during_scan_is_non_authoritative",
        "scanner::tests::p2_platform_scans_native_unicode_path_without_rewriting_it",
        "scanner::tests::p2_platform_symlink_loop_is_skipped_once_with_an_explicit_diagnostic"
      ],
      "listedTests": [
        "library::tests::p2_platform_rejects_configuration_that_enables_symlink_traversal",
        "library::tests::p2_platform_rejects_duplicate_and_overlapping_roots",
        "platform::tests::p2_platform_linux_keys_preserve_case_and_unicode_spelling",
        "platform::tests::p2_platform_macos_normalizes_unicode_without_assuming_volume_case_mode",
        "platform::tests::p2_platform_windows_keys_are_case_insensitive_and_unicode_normalized",
        "platform::tests::p2_platform_windows_portability_diagnostics_cover_names_characters_and_length",
        "scanner::tests::p2_platform_disconnect_during_scan_is_non_authoritative",
        "scanner::tests::p2_platform_permission_revocation_during_scan_is_non_authoritative",
        "scanner::tests::p2_platform_scans_native_unicode_path_without_rewriting_it",
        "scanner::tests::p2_platform_symlink_loop_is_skipped_once_with_an_explicit_diagnostic"
      ],
      "executedTests": [
        "library::tests::p2_platform_rejects_configuration_that_enables_symlink_traversal",
        "library::tests::p2_platform_rejects_duplicate_and_overlapping_roots",
        "platform::tests::p2_platform_linux_keys_preserve_case_and_unicode_spelling",
        "platform::tests::p2_platform_macos_normalizes_unicode_without_assuming_volume_case_mode",
        "platform::tests::p2_platform_windows_keys_are_case_insensitive_and_unicode_normalized",
        "platform::tests::p2_platform_windows_portability_diagnostics_cover_names_characters_and_length",
        "scanner::tests::p2_platform_disconnect_during_scan_is_non_authoritative",
        "scanner::tests::p2_platform_permission_revocation_during_scan_is_non_authoritative",
        "scanner::tests::p2_platform_scans_native_unicode_path_without_rewriting_it",
        "scanner::tests::p2_platform_symlink_loop_is_skipped_once_with_an_explicit_diagnostic"
      ],
      "summary": {
        "result": "ok",
        "passed": 10,
        "failed": 0,
        "ignored": 0,
        "measured": 0,
        "filteredOut": 28
      }
    },
    {
      "artifactName": "p2-a12-source-Linux-9ddfa4e8ada9c2268a3d8acf20c66e188bbd0751-attempt-1",
      "fileName": "p2-a12-platform-paths.json",
      "sha256": "90173b13f65ec9bade38db0d6606ba454923c8a500df7119e994889cd732b93e",
      "platform": "linux",
      "accepted": true,
      "startedAt": "2026-08-20T04:35:23.813Z",
      "completedAt": "2026-08-20T04:35:41.221Z",
      "environment": {
        "architecture": "x64",
        "nodeVersion": "v24.19.0",
        "rustc": "rustc 1.97.1 (8bab26f4f 2026-07-14)\nbinary: rustc\ncommit-hash: 8bab26f4f68e0e26f0bb7960be334d5b520ea452\ncommit-date: 2026-07-14\nhost: x86_64-unknown-linux-gnu\nrelease: 1.97.1\nLLVM version: 22.1.6",
        "cargo": "cargo 1.97.1 (c980f4866 2026-06-30)",
        "runnerOs": "Linux",
        "runnerArch": "X64",
        "runnerEnvironment": "github-hosted",
        "githubRunId": "32332405466",
        "githubRunAttempt": "1",
        "githubWorkflowRef": "BottleFish326/eagle/.github/workflows/ci.yml@refs/heads/main",
        "githubRepository": "BottleFish326/eagle",
        "githubServerUrl": "https://github.com"
      },
      "expectedTests": [
        "library::tests::p2_platform_rejects_configuration_that_enables_symlink_traversal",
        "library::tests::p2_platform_rejects_duplicate_and_overlapping_roots",
        "platform::tests::p2_platform_linux_keys_preserve_case_and_unicode_spelling",
        "platform::tests::p2_platform_macos_normalizes_unicode_without_assuming_volume_case_mode",
        "platform::tests::p2_platform_windows_keys_are_case_insensitive_and_unicode_normalized",
        "platform::tests::p2_platform_windows_portability_diagnostics_cover_names_characters_and_length",
        "scanner::tests::p2_platform_disconnect_during_scan_is_non_authoritative",
        "scanner::tests::p2_platform_linux_moved_mount_root_is_non_authoritative",
        "scanner::tests::p2_platform_linux_scans_case_distinct_files_as_separate_assets",
        "scanner::tests::p2_platform_permission_revocation_during_scan_is_non_authoritative",
        "scanner::tests::p2_platform_scans_native_unicode_path_without_rewriting_it",
        "scanner::tests::p2_platform_symlink_loop_is_skipped_once_with_an_explicit_diagnostic"
      ],
      "listedTests": [
        "library::tests::p2_platform_rejects_configuration_that_enables_symlink_traversal",
        "library::tests::p2_platform_rejects_duplicate_and_overlapping_roots",
        "platform::tests::p2_platform_linux_keys_preserve_case_and_unicode_spelling",
        "platform::tests::p2_platform_macos_normalizes_unicode_without_assuming_volume_case_mode",
        "platform::tests::p2_platform_windows_keys_are_case_insensitive_and_unicode_normalized",
        "platform::tests::p2_platform_windows_portability_diagnostics_cover_names_characters_and_length",
        "scanner::tests::p2_platform_disconnect_during_scan_is_non_authoritative",
        "scanner::tests::p2_platform_linux_moved_mount_root_is_non_authoritative",
        "scanner::tests::p2_platform_linux_scans_case_distinct_files_as_separate_assets",
        "scanner::tests::p2_platform_permission_revocation_during_scan_is_non_authoritative",
        "scanner::tests::p2_platform_scans_native_unicode_path_without_rewriting_it",
        "scanner::tests::p2_platform_symlink_loop_is_skipped_once_with_an_explicit_diagnostic"
      ],
      "executedTests": [
        "library::tests::p2_platform_rejects_configuration_that_enables_symlink_traversal",
        "library::tests::p2_platform_rejects_duplicate_and_overlapping_roots",
        "platform::tests::p2_platform_linux_keys_preserve_case_and_unicode_spelling",
        "platform::tests::p2_platform_macos_normalizes_unicode_without_assuming_volume_case_mode",
        "platform::tests::p2_platform_windows_keys_are_case_insensitive_and_unicode_normalized",
        "platform::tests::p2_platform_windows_portability_diagnostics_cover_names_characters_and_length",
        "scanner::tests::p2_platform_disconnect_during_scan_is_non_authoritative",
        "scanner::tests::p2_platform_linux_moved_mount_root_is_non_authoritative",
        "scanner::tests::p2_platform_linux_scans_case_distinct_files_as_separate_assets",
        "scanner::tests::p2_platform_permission_revocation_during_scan_is_non_authoritative",
        "scanner::tests::p2_platform_scans_native_unicode_path_without_rewriting_it",
        "scanner::tests::p2_platform_symlink_loop_is_skipped_once_with_an_explicit_diagnostic"
      ],
      "summary": {
        "result": "ok",
        "passed": 12,
        "failed": 0,
        "ignored": 0,
        "measured": 0,
        "filteredOut": 28
      }
    },
    {
      "artifactName": "p2-a12-source-Windows-9ddfa4e8ada9c2268a3d8acf20c66e188bbd0751-attempt-1",
      "fileName": "p2-a12-platform-paths.json",